2016,"XVIII",FALSE,"Умисне невиконання угоди про примирення або про визнання винуватості, ст.389-1","389-1",0,0,0,0,0,0,0,1,1
2016,"XVIII",FALSE,"Дії, що дезорганізують роботи виправних установ, ст.392","392",7,0,0,0,0,1,0,8,8
2016,"XVIII",FALSE,"Втеча з місця позбавлення волі або з-під варти, ст.393","393",9,0,0,0,0,0,0,27,23
2016,"XVIII",FALSE,"Порушення правил адміністративного нагляду, ст.395","395",7,0,0,1,0,21,0,420,386
2016,"XVIII",FALSE,"Погроза або насильство щодо захисника чи представника особи, ст.398","398",0,0,0,0,0,0,0,0,0
2016,"XVIII",FALSE,"Посягання на життя захисника чи представника особи у зв’язку з діяльністю, пов’язаною з наданням правової допомоги, ст.400","400",0,0,0,0,0,0,0,0,0
2016,"XIX",TRUE,"Правопорушення проти встановленого порядку несення військової служби (військові злочини)(р. XIХ КК України)",NA,2,0,0,0,0,27,0,43,21
2016,"XIX",FALSE,"Опір начальникові або примушування його до порушення службових обов’язків, ст.404","404",1,0,0,0,0,3,0,0,0
2016,"XIX",FALSE,"Погроза або насильство щодо начальника, ст.405","405",0,0,0,0,0,6,0,1,0
2016,"XIX",FALSE,"Порушення статутних правил взаємовідносин між військовослужбовцями за відсутності відносин підлеглості, ст.406","406",0,0,0,0,0,5,0,1,0
2016,"XIX",FALSE,"Самовільне залишення військової частини або місця служби, ст.407","407",0,0,0,0,0,3,0,33,16
2016,"XIX",FALSE,"Дезертирство, ст.408","408",0,0,0,0,0,2,0,2,2
2016,"XIX",FALSE,"Ухилення від військової служби шляхом самокалічення або іншим способом, ст.409","409",0,0,0,0,0,0,0,0,0
2016,"XIX",FALSE,"Викрадення, привласнення, вимагання військовослужбовцем зброї, бойових припасів, вибухових або інших бойових речовин, засобів пересування,  військової та спеціальної техніки чи іншого військового майна, а також заволодіння ними шляхом шахрайства або зловживання службовим становищем, ст.410","410",1,0,0,0,0,0,0,4,2
2016,"XIX",FALSE,"Умисне знищення або пошкодження військового майна, ст.411","411",0,0,0,0,0,1,0,0,0
2016,"XIX",FALSE,"Порушення правил поводження зі зброєю, а також із речовинами і предметами, що становлять підвищену небезпеку для оточення, ст.414","414",0,0,0,0,0,5,0,0,0
2016,"XIX",FALSE,"Порушення правил водіння або експлуатації машин, ст.415","415",0,0,0,0,0,2,0,0,0
2016,"XIX",FALSE,"Порушення правил польотів або підготовки до них, ст.416","416",0,0,0,0,0,0,0,0,0
2016,"XIX",FALSE,"Порушення правил кораблеводіння, ст.417","417",0,0,0,0,0,0,0,0,0
2016,"XIX",FALSE,"Порушення статутних правил вартової служби чи патрулювання, ст.418","418",0,0,0,0,0,0,0,0,0
2016,"XIX",FALSE,"Порушення правил несення прикордонної служби, ст.419","419",0,0,0,0,0,0,0,0,0
2016,"XIX",FALSE,"Порушення правил несення бойового чергування, ст.420","420",0,0,0,0,0,0,0,0,0
2016,"XIX",FALSE,"Порушення статутних правил внутрішньої служби, ст.421","421",0,0,0,0,0,0,0,1,1
2016,"XIX",FALSE,"Розголошення відомостей військового характеру, що становлять державну таємницю, або втрата документів чи матеріалів, що містять такі відомості, ст. 422","422",0,0,0,0,0,0,0,0,0
2016,"XIX",FALSE,"Зловживання військової службової особи владою або службовим становищем, ст.423","423",0,0,0,0,0,0,0,0,0
2016,"XIX",FALSE,"Перевищення військовою службовою особою влади чи службових повноважень, ст.424","424",0,0,0,0,0,0,0,0,0
2016,"XIX",FALSE,"Недбале ставлення до військової служби, ст.425","425",0,0,0,0,0,0,0,1,1
2016,"XIX",FALSE,"Бездіяльність військової влади, ст.426","426",0,0,0,0,0,0,0,0,0
2016,"XX",TRUE,"Правопорушення проти миру, безпеки людства та міжнародного правопорядку(р. XX КК України)",NA,0,0,0,0,0,0,0,0,0
2016,"XX",FALSE,"Публічне заперечення чи виправдання злочинів фашизму, пропаганда неонацистської ідеології, виготовлення та (або) розповсюдження матеріалів, у яких виправдовуються злочини фашистів і їх прибічників, ст. 436-1","436-1",0,0,0,0,0,0,0,0,0
