"Year","Chapter","IsChp","Article","Art","FS23X1","FS23X2","FS23X3","FS23X4","FS23X5","FS23X6","FS23X7","FS23X8","FS23X9"
2022,"I",TRUE,"Злочини проти основ національної безпеки України (р. І Кримінального кодексу України )",NA,46,10,0,0,0,5,0,40,17
2022,"I",FALSE,"Дії, спрямовані на насильницьку зміну чи повалення конституційного ладу або на захоплення державної влади, ст. 109","109",3,2,0,0,0,0,0,1,1
2022,"I",FALSE,"Посягання на територіальну цілісність і недоторканість України, ст. 110","110",11,0,0,0,0,0,0,4,1
2022,"I",FALSE,"Фінансування дій, вчинених з метою насильницької зміни чи повалення конституційного ладу або захоплення державної влади, зміни меж території або державного кордону України, ст. 110-2","110-2",0,0,0,0,0,0,0,0,0
2022,"I",FALSE,"Державна зрада, ст. 111","111",19,4,0,0,0,0,0,10,4
2022,"I",FALSE,"Колабораційна діяльність, ст.111-1","111-1",12,5,0,0,0,5,0,25,12
2022,"I",FALSE,"Пособництво державі-агресору, ст.111-2","111-2",0,0,0,0,0,0,0,1,0
2022,"I",FALSE,"Посягання на життя державного чи громадського діяча, ст. 112","112",3,2,0,0,0,0,0,0,0
2022,"I",FALSE,"Диверсія, ст. 113","113",0,0,0,0,0,0,0,0,0
2022,"I",FALSE,"Шпигунство, ст. 114","114",0,0,0,0,0,0,0,0,0
2022,"I",FALSE,"Перешкоджання законній діяльності Збройних Сил України та інших військових формувань, ст. 114-1","114-1",2,0,0,0,0,0,0,0,0
2022,"I",FALSE,"Несанкціоноване поширення інформації про направлення, переміщення зброї, озброєння та бойових припасів в Україну, рух, переміщення або розміщення Збройних Сил України чи інших утворених відповідно до законів України військових формувань, вчинене в умовах воєнного або надзвичайного стану, ст.114-2","114-2",2,0,0,0,0,0,0,1,0
2022,"II",TRUE,"Кримінальні правопорушення проти життя та здоров'я особи (р. ІІ Кримінального кодексу України )",NA,191,1,0,15,23,2589,25,2316,1172
2022,"II",FALSE,"Умисне вбивство, ст. 115","115",33,0,0,0,0,347,9,160,109
2022,"II",FALSE,"Умисне вбивство при перевищенні меж необхідної оборони або у разі перевищення заходів, необхідних для затримання злочинця, ст. 118","118",0,0,0,0,0,7,0,2,0
2022,"II",FALSE,"Умисне тяжке тілесне ушкодження, ст. 121","121",38,0,0,5,0,445,5,242,147
2022,"II",FALSE,"Умисне середньої тяжкості тілесне ушкодження, ст. 122","122",22,0,0,0,2,133,0,152,84
2022,"II",FALSE,"Домашнє насильство, ст. 126-1","126-1",0,0,0,0,0,280,1,272,166
2022,"III",TRUE,"Кримінальні правопорушення проти волі, честі та гідності особи (р. IІІ Кримінального кодексу України )",NA,61,11,0,5,0,16,0,19,10
2022,"III",FALSE,"Незаконне позбавлення волі або викрадення людини, ст. 146","146",56,11,0,5,0,16,0,17,9
2022,"III",FALSE,"Насильницьке зникнення, ст. 146-1","146-1",4,0,0,0,0,0,0,0,0
2022,"III",FALSE,"Захоплення заручників, ст. 147","147",0,0,0,0,0,0,0,0,0
2022,"III",FALSE,"Торгівля людьми, ст. 149","149",1,0,0,0,0,0,0,2,1
2022,"IV",TRUE,"Кримінальні правопорушення проти статевої свободи та статевої недоторканості особи (р. IV Кримінального кодексу України )",NA,8,0,0,0,3,42,1,48,29
2022,"IV",FALSE,"Згвалтування, ст. 152","152",5,0,0,0,2,32,1,32,20
2022,"IV",FALSE,"Сексуальне насильство, ст. 153","153",4,0,0,0,2,5,0,8,5
2022,"IV",FALSE,"Розбещення неповнолітніх, ст. 156","156",3,0,0,0,0,9,0,11,4
2022,"V",TRUE,"Кримінальні правопорушення проти виборчих, трудових та інших особистих прав і свобод людини  і громадянина (р. V Кримінального кодексу України )",NA,45,6,0,0,0,92,0,265,159
2022,"V",FALSE,"Порушення рівноправності громадян залежно від їх расової, національної належності, релігійних переконань, інвалідності та за іншими ознаками, ст. 161","161",0,0,0,0,0,0,0,1,1
2022,"V",FALSE,"Ухилення від сплати аліментів на утримання дітей, ст. 164*","164",0,0,0,0,0,0,0,63,34
2022,"V",FALSE,"Перешкоджання законній професійній діяльності журналістів, ст. 171*","171",3,0,0,0,0,0,0,0,0
2022,"V",FALSE,"Невиплата заробітної плати, стипендії, пенсії чи інших установлених  законом виплат, ст. 175","175",0,0,0,0,0,0,0,1,1
2022,"V",FALSE,"Порушення авторського права і суміжних прав, ст. 176","176",0,0,0,0,0,0,0,0,0
2022,"V",FALSE,"Порушення прав на винахід, корисну модель, промисловий зразок, топографію інтегральной мікросхеми, сорт рослин, раціоналізаторську пропозицію, ст. 177","177",0,0,0,0,0,0,0,0,0
2022,"VI",TRUE,"Кримінальні правопорушення проти власності (р. VІ Кримінального кодексу України )",NA,2193,82,10,194,130,1022,12,9071,6285
2022,"VI",FALSE,"Крадіжка, ст. 185","185",1603,6,0,156,103,780,5,7623,5285
2022,"VI",FALSE,"Грабіж, ст. 186","186",206,4,0,13,24,163,6,806,583
2022,"VI",FALSE,"Розбій, ст. 187","187",132,18,0,17,2,60,3,178,131
2022,"VI",FALSE,"Вимагання, ст. 189","189",63,6,1,4,5,1,0,23,15
2022,"VI",FALSE,"Шахрайство, ст. 190","190",158,33,9,13,3,36,0,708,496
2022,"VI",FALSE,"Привласнення, розтрата майна або заволодіння ним шляхом зловживання службовим становищем, ст. 191","191",78,19,0,0,0,1,0,19,4
2022,"VI",FALSE,"Умисне знищення або пошкодження майна, ст. 194","194",25,2,0,2,0,16,0,24,15
2022,"VI",FALSE,"Самовільне зайняття земельної ділянки та самовільне будівництво, ст. 197-1","197-1",0,0,0,0,0,0,0,7,3
2022,"VII",TRUE,"Кримінальні правопорушення у сфері господарської діяльності (р. VІІ Кримінального кодексу України )",NA,55,35,11,0,0,0,1,35,16
2022,"VII",FALSE,"Виготовлення, зберігання, придбання, перевезення, пересилання, ввезення в Україну з метою використання при продажу товарів, збуту або збут підроблених грошей, державних цінних паперів, що існують у паперовій формі, білетів державної лотереї, марок акцизного податку чи голографічних захисних елементів, ст.199","199",1,1,0,0,0,0,0,3,2
2022,"VII",FALSE,"Незаконні дії з документами на переказ, платіжними картками та іншими засобами доступу до банківських рахунків, електронними грошима, обладнанням для їх виготовлення, ст. 200","200",5,0,0,0,0,0,0,17,5
2022,"VII",FALSE,"Незаконне використання з метою отримання прибутку гуманітарної допомоги, благодійних пожертв або безоплатної допомоги, ст.201-2","201-2",9,2,0,0,0,0,0,3,3
2022,"VII",FALSE,"Незаконна діяльність з організації або проведення азартних ігор, лотерей, ст.203-2","203-2",12,12,8,0,0,0,0,1,1
2022,"VII",FALSE,"Незаконне виготовлення, зберігання, збут або транспортування з метою збуту підакцизних  товарів, ст. 204","204",18,17,3,0,0,0,0,3,2
2022,"VII",FALSE,"Підроблення документів, які подаються для проведення державної реєстрації юридичної особи та фізичних осіб-підприємців, ст. 205-1","205-1",3,0,0,0,0,0,0,1,1
2022,"VII",FALSE,"Протиправне заволодіння майном підприємства, установи, організації,  ст. 206-2","206-2",0,0,0,0,0,0,0,0,0
2022,"VII",FALSE,"Легалізація (відмивання) майна, одержаного злочинним шляхом, ст. 209","209",8,4,0,0,0,0,0,3,1
2022,"VII",FALSE,"Нецільове використання бюджетних коштів, здійснення видатків бюджету чи надання кредитів з бюджету без встановлених бюджетних призначень або з їх перевищенням, ст. 210","210",0,0,0,0,0,0,0,0,0
2022,"VII",FALSE,"Видання нормативно-правових актів, що зменшують надходження бюджету або збільшують витрати бюджету всупереч закону, ст. 211","211",0,0,0,0,0,0,0,0,0
2022,"VII",FALSE,"Ухилення від сплати податків, зборів (обов'язкових платежів), ст. 212","212",0,0,0,0,0,0,0,0,0
2022,"VII",FALSE,"Порушення порядку здійснення операцій з металобрухтом, ст.213","213",0,0,0,0,0,0,0,2,1
2022,"VII",FALSE,"Доведення банку до неплатоспроможності, ст. 218-1","218-1",0,0,0,0,0,0,0,0,0
2022,"VII",FALSE,"Порушення порядку ведення бази даних про вкладників або порядку формування звітності, ст. 220-1","220-1",0,0,0,0,0,0,0,0,0
2022,"VII",FALSE,"Фальсифікація фінансових документів та звітності фінансової організації, приховування неплатоспроможності фінансової установи або підстав для відкликання (анулювання) ліцензії фінансової установи, ст. 220-2","220-2",0,0,0,0,0,0,0,0,0
2022,"VII",FALSE,"Шахрайство з фінансовими ресурсами, ст. 222","222",0,0,0,0,0,0,0,2,0
2022,"VII",FALSE,"Підроблення документів, які подаються для реєстрації випуску цінних паперів, ст. 223-1","223-1",0,0,0,0,0,0,0,0,0
2022,"VII",FALSE,"Незаконна приватизація державного, комунального майна, ст. 233","233",0,0,0,0,0,0,0,0,0
2022,"VIII",TRUE,"Кримінальні правопорушення проти довкілля (р. VІІІ Кримінального кодексу України )",NA,125,15,0,3,2,2,0,114,57
2022,"VIII",FALSE,"Порушення правил охорони або використання надр, незаконне видобування корисних копалин, ст.240","240",3,0,0,0,0,0,0,5,4
2022,"VIII",FALSE,"Незаконна порубка або незаконне перевезення, зберігання, збут лісу, ст. 246","246",72,9,0,3,2,1,0,71,38
2022,"IX",TRUE,"Кримінальні правопорушення проти громадської безпеки (р. IX Кримінального кодексу України )",NA,139,52,26,10,0,116,12,531,302
2022,"IX",FALSE,"Створення злочинної організації, ст. 255","255",27,27,26,6,0,0,0,8,6
2022,"IX",FALSE,"Сприяння учасникам злочинних організацій та укриття їх злочинної  діяльності, ст. 256","256",0,0,0,0,0,0,0,0,0
2022,"IX",FALSE,"Бандитизм, ст. 257","257",11,11,0,3,0,0,0,5,3
2022,"IX",FALSE,"Терористичний акт, ст. 258","258",0,0,0,0,0,0,0,0,0
2022,"IX",FALSE,"Втягнення у вчинення терористичного акту, ст. 258-1","258-1",0,0,0,0,0,0,0,0,0
2022,"IX",FALSE,"Публічні заклики до вчинення терористичного акту, ст. 258-2","258-2",0,0,0,0,0,0,0,0,0
2022,"IX",FALSE,"Створення терористичної групи чи терористичної організації, ст. 258-3","258-3",8,0,0,0,0,0,0,1,1
2022,"IX",FALSE,"Сприяння вчиненню терористичного акту , ст. 258-4","258-4",0,0,0,0,0,0,0,0,0
2022,"IX",FALSE,"Фінансування тероризму, ст. 258-5","258-5",0,0,0,0,0,0,0,0,0
2022,"IX",FALSE,"Завідомо неправдиве повідомлення про загрозу безпеці громадян, знищення чи пошкодження об’єктів  власності, ст. 259","259",0,0,0,0,0,14,0,13,9
2022,"IX",FALSE,"Створення не передбачених законом воєнізованих або збройних формувань, ст. 260","260",14,4,0,0,0,0,0,3,3
2022,"IX",FALSE,"Викрадення, привласнення, вимагання вогнепальної зброї, бойових припасів, вибухових речовин чи радіоактивних матеріалів або заволодіння ними шляхом шахрайства або зловживанням службовим становищем, ст. 262","262",5,0,0,0,0,5,0,6,5
2022,"IX",FALSE,"Незаконне поводження зі зброєю, бойовими припасами або вибуховими  речовинами, ст. 263","263",85,21,0,3,0,100,12,496,277
2022,"IX",FALSE,"Незаконне виготовлення, переробка чи ремонт вогнепальної зброї або фальсифікація, незаконне видалення чи зміна її маркування, або незаконне виготовлення бойових припасів, вибухових речовин чи вибухових  пристроїв, ст. 263-1","263-1",0,0,0,0,0,5,0,12,5
2022,"IX",FALSE,"Недбале зберігання вогнепальної зброї або бойових припасів, ст. 264","264",0,0,0,0,0,1,0,0,0
2022,"IX",FALSE,"Незаконне поводження з радіоактивними матеріалами, ст. 265","265",0,0,0,0,0,0,0,0,0
2022,"IX",FALSE,"Порушення правил поводження з вибуховими, легкозаймистими та їдкими речовинами або радіоактивними матеріалами, ст. 267","267",0,0,0,0,0,0,0,0,0
2022,"X",TRUE,"Кримінальні правопорушення проти безпеки виробництва (р. X Кримінального кодексу України )",NA,0,0,0,0,0,0,0,0,0
2022,"XI",TRUE,"Кримінальні правопорушення проти безпеки руху та експлуатації транспорту  (р. XІ Кримінального кодексу України )",NA,198,25,0,34,13,554,24,307,178
2022,"XI",FALSE,"Порушення правил безпеки руху або експлуатації залізничного, водного чи повітряного транспорту, ст. 276","276",0,0,0,0,0,0,0,0,0
2022,"XI",FALSE,"Порушення правил безпеки дорожнього  руху або експлуатації транспорту особами,  які керують транспортними засобами, ст. 286","286",0,0,0,0,0,2,0,40,13
2022,"XI",FALSE,"Незаконне заволодіння транспортним засобом, ст. 289","289",196,25,0,34,13,126,6,238,160
2022,"XI",FALSE,"Знищення, підробка або заміна номерів вузлів та агрегатів транспортного  засобу, ст. 290*","290",0,0,0,0,0,0,0,0,0
2022,"XII",TRUE,"Кримінальні правопорушення проти громадського порядку та моральності  (р. XІІ Кримінального кодексу України )",NA,145,12,2,27,11,260,5,140,84
2022,"XII",FALSE,"Хуліганство, ст. 296","296",103,0,0,7,11,241,5,94,56
2022,"XII",FALSE,"Наруга над могилою, іншим місцем поховання або над тілом померлого,  ст. 297","297",6,0,0,0,0,6,0,23,15
2022,"XII",FALSE,"Жорстоке поводження з тваринами, ст. 299","299",1,0,0,0,0,9,0,5,2
2022,"XII",FALSE,"Ввезення, виготовлення, збут і розповсюдження порнографічних предметів, ст. 301","301",1,0,0,0,0,1,0,3,1
2022,"XII",FALSE,"Створення або утримання місць розпусти і звідництво, ст. 302","302",5,5,0,0,0,0,0,0,0
2022,"XII",FALSE,"Сутенерство або втягнення особи в заняття проституцією, ст. 303","303",9,8,0,0,0,0,0,1,1
2022,"XII",FALSE,"Втягнення неповнолітніх у протиправну діяльність, ст. 304","304",22,4,2,20,0,1,0,8,5
2022,"XIII",TRUE,"Кримінальні правопорушення у сфері обігу наркотичних засобів, психотропних речовин, їх аналогів або прекурсорів та інші кримінальні правопорушення проти здоров'я населення (р. XІІІ Кримінального кодексу України )",NA,237,83,20,8,2,69,338,2033,1098
2022,"XIII",FALSE,"Контрабанда наркотичних засобів, психотропних речовин, їх аналогів чи прекурсорів або фальсифікованих лікарських засобів, ст. 305","305",5,3,0,0,0,0,4,0,0
2022,"XIII",FALSE,"Використання коштів, здобутих від незаконного обігу наркотичних засобів, психотропних речовин, їх аналогів, прекурсорів, отруйних чи сильнодіючих речовин або отруйних чи сильнодіючих лікарських засобів, ст. 306","306",6,6,0,0,0,0,0,3,2
2022,"XIII",FALSE,"Незаконне виробництво, виготовлення, придбання, зберігання, перевезення, пересилання чи збут наркотичних засобів, психотропних речовин або  їх аналогів, ст. 307","307",193,74,20,8,1,2,34,288,158
2022,"XIII",FALSE,"Викрадення, привласнення, вимагання наркотичних засобів, психотропних речовин або їх аналогів чи заволодіння ними шляхом шахрайства або зловживання службовим становищем, ст. 308","308",0,0,0,0,0,1,0,6,5
2022,"XIII",FALSE,"Незаконне виробництво, виготовлення, придбання, зберігання, перевезення чи пересилання наркотичних засобів, психотропних речовин або їх аналогів  без мети збуту, ст. 309","309",45,5,0,2,1,64,300,1674,915
2022,"XIII",FALSE,"Посів або вирощування снотворного маку чи конопель ст. 310","310",16,8,0,0,0,3,14,202,80
2022,"XIII",FALSE,"Незаконне виробництво, виготовлення, придбання, зберігання, перевезення чи пересилання прекурсорів, ст. 311","311",17,10,0,0,0,0,1,13,7
2022,"XIII",FALSE,"Викрадення, привласнення, вимагання прекурсорів або заволодіння ними шляхом шахрайства або зловживання службовим становищем, ст. 312","312",0,0,0,0,0,0,0,0,0
2022,"XIII",FALSE,"Викрадення, привласнення, вимагання обладнання, призначеного для  виготовлення наркотичних засобів, психотропних речовин, або їх аналогів чи заволодіння ним шляхом шахрайства або зловживання службовим становищем та інші незаконні дії з таким обладнанням, ст. 313","313",3,2,0,0,0,0,1,2,1
2022,"XIII",FALSE,"Незаконне введення в організм наркотичних засобів,  психотропних речовин або їх аналогів, ст. 314","314",0,0,0,0,0,0,0,0,0
2022,"XIII",FALSE,"Схиляння до вживання наркотичних засобів,  психотропних речовин або їх аналогів, ст. 315","315",0,0,0,0,0,0,0,2,1
2022,"XIII",FALSE,"Незаконне публічне вживання наркотичних засобів, ст. 316","316",0,0,0,0,0,0,0,1,0
2022,"XIII",FALSE,"Організація або утримання місць для незаконного вживання, виробництва чи виготовлення наркотичних засобів, психотропних речовин або їх аналогів,  ст. 317","317",23,14,0,1,0,2,5,26,15
2022,"XIII",FALSE,"Незаконне виготовлення, підроблення, використання чи збут підроблених документів на отримання наркотичних засобів, психотропних речовин або прекурсорів, ст. 318","318",0,0,0,0,0,0,0,1,1
2022,"XIII",FALSE,"Незаконна видача рецепта на право придбання наркотичних засобів або психотропних речовин, ст. 319","319",2,0,0,0,0,0,0,0,0
2022,"XIII",FALSE,"Порушення встановлених правил обігу наркотичних засобів, психотропних речовин, їх аналогів  або прекурсорі, ст. 320","320",1,0,0,0,0,0,0,0,0
2022,"XIII",FALSE,"Незаконне виробництво, виготовлення, придбання, перевезення, пересилання, зберігання з метою збуту або збут отруйних чи сильнодіючих речовин або отруйних чи сильнодіючих лікарських засобів, ст. 321","321",8,3,0,0,0,0,1,15,9
2022,"XIII",FALSE,"Незаконна організація або утримання місць для вживання одурманюючих засобів, ст. 322","322",0,0,0,0,0,0,0,0,0
2022,"XIII",FALSE,"Спонукання неповнолітніх до застосування допінгу, ст. 323","323",0,0,0,0,0,0,0,0,0
2022,"XIII",FALSE,"Схиляння неповнолітніх до вживання одурманюючих засобів, ст. 324","324",0,0,0,0,0,0,0,0,0
2022,"XIV",TRUE,"Кримінальні правопорушення у сфері охорони державної таємниці, недоторканності державних кордонів, забезпечення призову та мобілізації (р. XІV Кримінального кодексу України )",NA,160,35,0,5,0,0,0,32,15
2022,"XIV",FALSE,"Незаконне переправлення осіб через державний кордон України, ст. 332","332",158,34,0,5,0,0,0,10,7
2022,"XIV",FALSE,"Порушення порядку в'їзду на тимчасово окуповану територію України та виїзду з неї, ст. 332-1","332-1",0,0,0,0,0,0,0,0,0
2022,"XIV",FALSE,"Незаконне перетинання державного кордону України, ст. 332-2","332-2",2,0,0,0,0,0,0,3,1
