2016,"XVI",FALSE,"Несанкціоноване втручання в роботу державних електронних інформаційних ресурсів або інформаційних, телекомунікаційних, інформаційно-телекомунікаційних систем, критичних об'єктів національної інформаційної інфраструктури, ст. 361-3","361-3",0,NA,0,NA,0,0,0,0,0,0,0,0,0,0,0,0,0,0,0,0,0,0,0,0,0
2016,"XVI",FALSE,"Несанкціоновані збут або розповсюдження інформації з обмеженим доступом, яка оброблюється в державних електронних інформаційних ресурсах, ст. 361-4","361-4",0,NA,0,NA,0,0,0,0,0,0,0,0,0,0,0,0,0,0,0,0,0,0,0,0,0
2016,"XVI",FALSE,"Несанкціоновані дії з інформацією, яка оброблюється в державних електронних інформаційних ресурсах або інформаційних, телекомунікаційних, інформаційно-телекомунікаційних системах критичних об'єктів національної інформаційної інфраструктури, вчинені особою, яка має право доступу до неї, ст. 362-1","362-1",0,NA,0,NA,0,0,0,0,0,0,0,0,0,0,0,0,0,0,0,0,0,0,0,0,0
2016,"XVII",TRUE,"Правопорушення у сфері службової діяльності та професійної діяльності, пов'язаної з наданням публічних послуг(р. XVII КК України)",NA,2908,NA,12,NA,1737,133,0,0,0,283,600,587,146,121,377,1383,208,139,7,1713,24,21,0,1,0
2016,"XVII",FALSE,"Зловживання владою або службовим становищем,    ст. 364","364",117,NA,0,NA,83,1,0,0,0,7,20,37,12,7,17,74,6,3,0,83,0,0,0,0,0
2016,"XVII",FALSE,"Зловживання повноваженнями службовою особою юридичної особи приватного права незалежно від організаційно-правової форми, ст. 364-1","364-1",29,NA,0,NA,20,1,0,0,0,1,10,3,3,3,3,14,5,1,0,20,0,0,0,0,0
2016,"XVII",FALSE,"Перевищення влади або службових повноважень, ст. 365","365",102,NA,1,NA,70,3,0,0,0,40,26,4,0,0,0,54,9,7,0,70,0,0,0,0,0
2016,"XVII",FALSE,"Перевищення повноважень службовою особою юридичної особи приватного права незалежно від організаційно-правової форми, ст. 365-1","365-1",0,NA,0,NA,0,0,0,0,0,0,0,0,0,0,0,0,0,0,0,0,0,0,0,0,0
2016,"XVII",FALSE,"Зловживання повноваженями особами, які надають публічні послуги, ст. 365-2","365-2",4,NA,0,NA,3,0,0,0,0,0,3,0,0,0,1,3,0,0,0,3,0,0,0,0,0
2016,"XVII",FALSE,"Службове підроблення, ст. 366","366",1323,NA,1,NA,557,6,0,0,0,57,136,242,63,59,211,428,91,38,0,556,1,1,0,0,0
2016,"XVII",FALSE,"Службова недбалість, ст. 367","367",136,NA,2,NA,115,1,0,0,0,16,24,43,12,20,30,80,23,12,0,115,0,0,0,0,0
2016,"XVII",FALSE,"Одержання хабара / Прийняття пропозиції, обіцянки або одержання неправомірної вигоди службовою особою, ст. 368","368",834,NA,6,NA,579,76,0,0,0,115,236,166,38,24,79,523,32,24,0,579,0,0,0,0,0
2016,"XVII",FALSE,"Незаконне збагачення, ст. 368-2","368-2",0,NA,0,NA,0,0,0,0,0,0,0,0,0,0,0,0,0,0,0,0,0,0,0,0,0
2016,"XVII",FALSE,"Комерційний підкуп / підкуп службової особи юридичної особи приватного права незалежно від організаційно-правової форми, ст. 368-3","368-3",32,NA,0,NA,28,2,0,0,0,3,10,11,2,2,6,20,3,5,0,28,0,0,0,0,0
2016,"XVII",FALSE,"Підкуп особи, яка надає публічні послуги, ст. 368-4","368-4",13,NA,0,NA,9,2,0,0,0,0,3,5,1,0,4,9,0,0,0,9,0,0,0,0,0
2016,"XVII",FALSE,"Пропозиція або давання хабара / Пропозиція або надання неправомірної вигоди службовій особі, ст. 369","369",209,NA,2,NA,174,19,0,0,0,25,69,59,10,11,28,92,35,41,6,152,22,19,0,1,0
2016,"XVII",FALSE,"Зловживання впливом, ст. 369-2","369-2",204,NA,0,NA,189,26,0,0,0,30,91,50,13,5,20,168,8,12,1,188,1,1,0,0,0
2016,"XVII",FALSE,"Провокація хабара або комерційного підкупу / Провокація підкупу, ст. 370","370",1,NA,0,NA,0,0,0,0,0,0,0,0,0,0,0,0,0,0,0,0,0,0,0,0,0
2016,"XVIII",TRUE,"Правопорушення проти правосуддя(р. XVIII КК України)",NA,1795,NA,8,NA,1677,113,0,0,15,587,653,348,52,22,198,115,345,1163,54,1667,7,5,3,0,0
2016,"XVIII",FALSE,"Погроза або насильство щодо судді, народного засідателя чи присяжного, ст. 377","377",6,NA,0,NA,6,0,0,0,0,2,2,1,1,0,0,0,1,5,0,6,0,0,0,0,0
2016,"XVIII",FALSE,"Посягання на життя судді, народного засідателя чи присяжного у зв’язку з їх діяльністю, пов’язаною із здійсненням  правосуддя, ст. 379","379",0,NA,0,NA,0,0,0,0,0,0,0,0,0,0,0,0,0,0,0,0,0,0,0,0,0
2016,"XVIII",FALSE,"Невиконання слідчим вказівок прокурора, ст.381-1","381-1",0,NA,0,NA,0,0,0,0,0,0,0,0,0,0,0,0,0,0,0,0,0,0,0,0,0
2016,"XVIII",FALSE,"Умисне невиконання угоди про примирення або про визнання винуваності, ст.389-1","389-1",2,NA,0,NA,1,0,0,0,0,0,0,1,0,0,0,0,0,1,0,1,0,0,0,0,0
2016,"XVIII",FALSE,"Дії, що дезорганізують роботи виправних установ,  ст. 392","392",8,NA,0,NA,8,0,0,0,0,3,5,0,0,0,0,0,3,5,0,8,0,0,0,0,0
2016,"XVIII",FALSE,"Втеча з місця позбавлення волі або з-під варти, ст. 393","393",42,NA,6,NA,38,23,0,0,1,17,14,6,0,0,3,4,11,22,1,37,1,1,0,0,0
2016,"XVIII",FALSE,"Порушення правил адміністративного нагляду, ст. 395","395",489,NA,0,NA,464,45,0,0,0,145,207,93,16,3,18,8,68,368,20,462,0,0,2,0,0
2016,"XVIII",FALSE,"Погроза або насильство щодо захисника чи представника особи, ст. 398","398",4,NA,0,NA,3,0,0,0,0,1,2,0,0,0,0,2,0,1,0,3,0,0,0,0,0
2016,"XVIII",FALSE,"Посягання на життя захисника чи представника особи у зв’язку з діяльністю, пов’язаною з наданням правової допомоги, ст. 400","400",0,NA,0,NA,0,0,0,0,0,0,0,0,0,0,0,0,0,0,0,0,0,0,0,0,0
2016,"XIX",TRUE,"Правопорушення проти встановленого порядку несення військової служби (військові злочини)(р. XIХ КК України)",NA,2584,NA,2,NA,2007,86,0,0,0,824,766,401,15,1,6,285,816,903,3,2007,0,0,0,0,0
2016,"XIX",FALSE,"Опір начальникові або примушування його до порушення службових обов’язків, ст.404","404",9,NA,0,NA,7,0,0,0,0,2,4,1,0,0,0,4,1,2,0,7,0,0,0,0,0
2016,"XIX",FALSE,"Погроза або насильство щодо начальника, ст.405","405",29,NA,0,NA,28,2,0,0,0,16,7,5,0,0,0,3,16,9,0,28,0,0,0,0,0
2016,"XIX",FALSE,"Порушення статутних правил взаємовідносин між війсковослужбовцями за відсутності відносин підлеглості, ст.406","406",47,NA,0,NA,43,3,0,0,0,31,8,4,0,0,0,3,20,20,0,43,0,0,0,0,0
2016,"XIX",FALSE,"Самовільне залишення військової частини або місця служби, ст.407","407",1876,NA,1,NA,1556,65,0,0,0,632,606,306,12,0,3,155,643,755,3,1556,0,0,0,0,0
2016,"XIX",FALSE,"Дезертирство, ст.408","408",362,NA,1,NA,138,9,0,0,0,51,50,36,1,0,0,39,55,44,0,138,0,0,0,0,0
2016,"XIX",FALSE,"Ухилення від військової служби шляхом самокалічення або іншим способом, ст.409","409",8,NA,0,NA,6,0,0,0,0,4,2,0,0,0,0,5,1,0,0,6,0,0,0,0,0
2016,"XIX",FALSE,"Викрадення, привласнення, вимагання військовослужбовцем зброї, бойових припасів, вибухових або інших бойових речовин, засобів пересування,  військової та спеціальної техніки чи іншого військового майна, а також заволодіння ними шляхом шахрайства або зловживання службовим становищем, ст.410","410",45,NA,0,NA,38,5,0,0,0,16,15,7,0,0,0,9,16,13,0,38,0,0,0,0,0
2016,"XIX",FALSE,"Умисне знищення або пошкодження військового майна, ст.411","411",1,NA,0,NA,1,0,0,0,0,1,0,0,0,0,0,0,0,1,0,1,0,0,0,0,0
2016,"XIX",FALSE,"Порушення правил поводження зі зброєю, а також із речовинами і предметами, що становлять підвищену небезпеку для оточення, ст.414","414",38,NA,0,NA,35,3,0,0,0,16,13,5,1,0,1,8,13,14,0,35,0,0,0,0,0
2016,"XIX",FALSE,"Порушення правил водіння або експлуатації машин, ст.415","415",13,NA,0,NA,9,0,0,0,0,1,8,0,0,0,0,2,4,3,0,9,0,0,0,0,0
2016,"XIX",FALSE,"Порушення правил польотів або підготовки до них, ст.416","416",1,NA,0,NA,1,0,0,0,0,0,0,1,0,0,0,1,0,0,0,1,0,0,0,0,0
2016,"XIX",FALSE,"Порушення правил кораблеводіння, ст.417","417",0,NA,0,NA,0,0,0,0,0,0,0,0,0,0,0,0,0,0,0,0,0,0,0,0,0
2016,"XIX",FALSE,"Порушення статутних правил вартової служби чи патрулювання, ст.418","418",2,NA,0,NA,2,2,0,0,0,0,2,0,0,0,0,2,0,0,0,2,0,0,0,0,0
2016,"XIX",FALSE,"Порушення правил несення прикордонної служби, ст.419","419",2,NA,0,NA,2,0,0,0,0,1,0,1,0,0,0,0,0,2,0,2,0,0,0,0,0
2016,"XIX",FALSE,"Порушення правил несення бойового чергування, ст.420","420",0,NA,0,NA,0,0,0,0,0,0,0,0,0,0,0,0,0,0,0,0,0,0,0,0,0
2016,"XIX",FALSE,"Порушення статутних правил внутрішньої служби, ст.421","421",3,NA,0,NA,3,0,0,0,0,1,1,1,0,0,0,0,1,2,0,3,0,0,0,0,0
2016,"XIX",FALSE,"Розголошення відомостей військового характеру, що становлять державну таємницю, або втрата документів чи матеріалів, що містять такі відомості, ст. 422","422",0,NA,0,NA,0,0,0,0,0,0,0,0,0,0,0,0,0,0,0,0,0,0,0,0,0
2016,"XIX",FALSE,"Зловживання військової службової особи владою або службовим становищем, ст.423","423",0,NA,0,NA,0,0,0,0,0,0,0,0,0,0,0,0,0,0,0,0,0,0,0,0,0
2016,"XIX",FALSE,"Перевищення військовою службовою особою влади чи службових повноважень, ст.424","424",0,NA,0,NA,0,0,0,0,0,0,0,0,0,0,0,0,0,0,0,0,0,0,0,0,0
2016,"XIX",FALSE,"Недбале ставлення до військової служби, ст.425","425",18,NA,0,NA,11,0,0,0,0,2,3,5,1,0,0,8,3,0,0,11,0,0,0,0,0
2016,"XIX",FALSE,"Бездіяльність військової влади, ст.426","426",20,NA,0,NA,18,1,0,0,0,10,5,3,0,0,0,8,8,2,0,18,0,0,0,0,0
2016,"XX",TRUE,"Правопорушення проти миру, безпеки людства та міжнародного правопорядку(р. XX КК України)",NA,8,NA,0,NA,2,1,0,0,0,0,2,0,0,0,0,1,0,1,0,1,1,1,0,0,0
2016,"XX",FALSE,"Публічне заперечення чи виправдання злочинів фашизму, пропаганда неонацистської ідеології, виготовлення та (або) розповсюдження матеріалів, у яких виправдовуються злочини фашистів і їх прибічників, ст. 436-1","436-1",0,NA,0,NA,0,0,0,0,0,0,0,0,0,0,0,0,0,0,0,0,0,0,0,0,0
