"Year","Chapter","IsChp","Article","Art","FS1","FS2","FS3","FS4","FS5","FS6","FS7","FS8","FS9","FS10","FS11","FS12","FS13","FS14","FS15","FS16","FS17","FS18","FS19","FS20","FS21","FS22","FS23","FS24","FS25"
2021,"I",TRUE,"Злочини проти основ національної безпеки України (р. І Кримінального кодексу України )",NA,166,11,0,0,111,8,0,0,0,19,36,36,7,13,11,40,21,48,2,0,106,5,0,0,0
2021,"I",FALSE,"Дії, спрямовані на насильницьку зміну чи повалення конституційного ладу або на захоплення державної влади, ст. 109","109",17,0,0,0,10,0,0,0,0,0,2,7,0,1,1,3,0,7,0,0,10,0,0,0,0
2021,"I",FALSE,"Посягання на територіальну цілісність і недоторканість України, ст. 110","110",68,7,0,0,49,3,0,0,0,8,10,16,5,10,8,18,10,19,2,0,47,2,0,0,0
2021,"I",FALSE,"Фінансування дій, вчинених з метою насильницької зміни чи повалення конституційного ладу або захоплення державної влади, зміни меж території або державного кордону України, ст. 110-2","110-2",6,0,0,0,6,0,0,0,0,1,3,1,0,1,1,4,0,2,0,0,5,1,0,0,0
2021,"I",FALSE,"Державна зрада, ст. 111","111",78,6,0,0,50,5,0,0,0,11,22,13,3,1,1,19,11,20,0,0,48,2,0,0,0
2021,"I",FALSE,"Посягання на життя державного чи громадського діяча, ст. 112","112",0,0,0,0,0,0,0,0,0,0,0,0,0,0,0,0,0,0,0,0,0,0,0,0,0
2021,"I",FALSE,"Диверсія, ст. 113","113",0,0,0,0,0,0,0,0,0,0,0,0,0,0,0,0,0,0,0,0,0,0,0,0,0
2021,"I",FALSE,"Шпигунство, ст. 114","114",4,1,0,0,2,0,0,0,0,0,0,2,0,0,0,1,0,1,0,0,0,2,0,0,0
2021,"I",FALSE,"Перешкоджання законній діяльності Збройних Сил України та інших військових формувань, ст. 114-1","114-1",2,0,0,0,0,0,0,0,0,0,0,0,0,0,0,0,0,0,0,0,0,0,0,0,0
2021,"II",TRUE,"Кримінальні правопорушення проти життя та здоров'я особи (р. ІІ Кримінального кодексу України )",NA,21810,0,2,0,20866,1357,20,58,325,4696,7252,6316,1074,1125,2181,1874,4357,14374,194,67,20711,139,16,3,1
2021,"II",FALSE,"Умисне вбивство, ст. 115","115",1262,0,0,0,907,690,1,3,11,164,285,293,66,84,104,79,167,645,11,5,891,15,1,0,0
2021,"II",FALSE,"Умисне вбивство при перевищенні меж необхідної оборони або у разі перевищення заходів, необхідних для затримання злочинця, ст. 118","118",12,0,1,0,11,4,0,0,0,2,4,2,2,1,4,3,4,4,0,0,11,0,0,0,0
2021,"II",FALSE,"Умисне тяжке тілесне ушкодження, ст. 121","121",1626,0,1,0,1322,560,3,9,33,276,482,390,59,70,158,120,267,905,21,9,1299,21,2,0,0
2021,"II",FALSE,"Умисне середньої тяжкості тілесне ушкодження, ст. 122","122",1614,0,0,0,1549,24,1,12,57,517,538,323,56,45,51,154,314,1056,19,6,1537,10,2,1,0
2021,"II",FALSE,"Домашнє насильство, ст. 126-1","126-1",1905,0,0,0,1870,7,0,0,1,141,702,806,121,99,68,84,406,1358,16,6,1862,7,1,0,0
2021,"III",TRUE,"Кримінальні правопорушення проти волі, честі та гідності особи (р. IІІ Кримінального кодексу України )",NA,429,18,0,0,286,111,0,0,1,85,138,54,3,5,12,46,57,176,3,4,265,21,0,0,0
2021,"III",FALSE,"Незаконне позбавлення волі або викрадення людини, ст. 146","146",382,16,0,0,267,101,0,0,1,82,128,50,3,3,9,37,57,168,3,2,248,19,0,0,0
2021,"III",FALSE,"Насильницьке зникнення, ст. 146-1","146-1",2,0,0,0,2,0,0,0,0,1,1,0,0,0,0,2,0,0,0,0,2,0,0,0,0
2021,"III",FALSE,"Захоплення заручників, ст. 147","147",3,0,0,0,2,2,0,0,0,0,2,0,0,0,0,1,0,1,0,0,2,0,0,0,0
2021,"III",FALSE,"Торгівля людьми, ст. 149","149",44,2,0,0,12,8,0,0,0,0,6,4,0,2,0,6,0,6,0,0,10,2,0,0,0
2021,"IV",TRUE,"Кримінальні правопорушення проти статевої свободи та статевої недоторканості особи (р. IV Кримінального кодексу України )",NA,417,0,0,0,330,169,2,6,7,110,93,85,13,14,1,27,62,223,12,6,321,9,0,0,0
2021,"IV",FALSE,"Згвалтування, ст. 152","152",253,0,0,0,197,129,1,5,6,61,60,51,5,8,0,12,40,132,8,5,192,5,0,0,0
2021,"IV",FALSE,"Сексуальне насильство, ст. 153","153",44,0,0,0,37,23,1,1,1,6,9,14,3,2,0,4,5,26,2,0,36,1,0,0,0
2021,"IV",FALSE,"Розбещення неповнолітніх, ст. 156","156",104,0,0,0,81,37,0,0,0,18,22,26,7,8,1,10,16,51,3,1,78,3,0,0,0
2021,"V",TRUE,"Кримінальні правопорушення проти виборчих, трудових та інших особистих прав і свобод людини  і громадянина (р. V Кримінального кодексу України )",NA,2440,0,0,0,2394,45,0,4,15,358,1076,750,110,81,210,167,490,1708,20,9,2386,5,3,0,0
2021,"V",FALSE,"Порушення рівноправності громадян залежно від їх расової, національної належності, релігійних переконань, інвалідності та за іншими ознаками, ст. 161","161",10,0,0,0,8,0,0,0,0,4,1,2,0,1,0,3,0,5,0,0,8,0,0,0,0
2021,"V",FALSE,"Ухилення від сплати аліментів на утримання дітей, ст. 164*","164",992,0,0,0,980,0,0,0,0,98,560,317,5,0,32,57,245,673,4,1,978,1,1,0,0
2021,"V",FALSE,"Перешкоджання законній професійній діяльності журналістів, ст. 171*","171",25,0,0,0,21,0,0,0,0,5,10,5,0,1,1,10,0,11,0,0,20,1,0,0,0
2021,"V",FALSE,"Невиплата заробітної плати, стипендії, пенсії чи інших установлених  законом виплат, ст. 175","175",11,0,0,0,11,0,0,0,0,0,4,6,0,1,2,9,0,2,0,0,11,0,0,0,0
2021,"V",FALSE,"Порушення авторського права і суміжних прав, ст. 176","176",5,0,0,0,5,0,0,0,0,2,0,3,0,0,0,1,1,3,0,0,5,0,0,0,0
2021,"V",FALSE,"Порушення прав на винахід, корисну модель, промисловий зразок, топографію інтегральной мікросхеми, сорт рослин, раціоналізаторську пропозицію, ст. 177","177",3,0,0,0,3,0,0,0,0,0,3,0,0,0,0,3,0,0,0,0,3,0,0,0,0
2021,"VI",TRUE,"Кримінальні правопорушення проти власності (р. VІ  Кримінального кодексу  України )",NA,47886,8,10,0,44452,4058,120,609,1064,11808,17994,10524,1273,1060,6971,3100,7441,32565,891,455,43764,625,63,17,3
2021,"VI",FALSE,"Крадіжка, ст. 185","185",38168,0,3,0,36280,2414,99,517,852,9348,14760,8809,1051,844,5561,2005,6088,27087,722,378,35754,471,55,15,2
2021,"VI",FALSE,"Грабіж, ст. 186","186",4025,0,3,0,3632,1146,17,79,151,1270,1508,540,39,28,212,156,574,2732,120,50,3549,79,4,0,2
2021,"VI",FALSE,"Розбій, ст. 187","187",1117,8,0,0,854,560,0,10,38,331,321,140,10,4,25,60,139,627,19,9,810,44,0,0,0
2021,"VI",FALSE,"Вимагання, ст. 189","189",362,0,0,0,207,80,2,5,4,69,84,39,3,1,9,40,15,144,7,1,195,12,0,0,0
2021,"VI",FALSE,"Шахрайство, ст. 190","190",3734,0,1,0,3287,146,3,9,45,901,1405,746,85,93,912,430,557,2234,40,26,3249,32,6,2,0
2021,"VI",FALSE,"Привласнення, розтрата майна або заволодіння ним шляхом зловживання службовим становищем, ст. 191","191",911,0,2,0,643,5,0,0,0,100,211,224,59,49,255,386,92,165,0,0,639,4,0,0,0
2021,"VI",FALSE,"Умисне знищення або пошкодження майна, ст. 194","194",237,0,1,0,168,40,0,0,1,55,61,34,8,9,14,20,38,108,2,0,165,3,0,0,0
2021,"VI",FALSE,"Самовільне зайняття земельної ділянки та самовільне будівництво, ст. 197-1","197-1",287,0,0,0,253,0,0,0,0,19,47,123,26,38,30,49,69,135,0,0,252,1,0,0,0
2021,"VII",TRUE,"Кримінальні правопорушення у сфері господарської діяльності (р. VІІ Кримінального кодексу України )",NA,1003,1,0,0,818,32,0,0,1,177,294,249,45,52,223,252,127,428,6,5,800,18,0,0,1
2021,"VII",FALSE,"Виготовлення, зберігання, придбання, перевезення, пересилання, ввезення в Україну з метою використання при продажу товарів, збуту або збут підроблених грошей, державних цінних паперів, білетів державної лотереї, марок акцизного податку чи голографічних захисних елементів, ст. 199","199",75,0,0,0,51,14,0,0,0,10,21,16,2,2,4,16,7,27,1,0,49,2,0,0,0
2021,"VII",FALSE,"Незаконні дії з документами на переказ, платіжними картками та іншими засобами доступу до банківських рахунків, електронними грошима, обладнанням для їх виготовлення, ст. 200","200",95,0,0,0,77,4,0,0,1,27,38,10,1,0,27,33,6,38,0,0,75,2,0,0,0
2021,"VII",FALSE,"Незаконна діяльність з організації або проведення азартних ігор, лотерей, ст. 203-2","203-2",27,0,0,0,7,0,0,0,0,3,3,1,0,0,5,2,2,3,0,0,7,0,0,0,0
2021,"VII",FALSE,"Незаконне виготовлення, зберігання, збут або транспортування з метою збуту підакцизних  товарів, ст. 204","204",196,0,0,0,168,0,0,0,0,21,67,57,12,11,27,51,36,80,1,0,164,4,0,0,1
2021,"VII",FALSE,"Підроблення документів, які подаються для проведення державної реєстрації юридичної особи та фізичних осіб-підприємців, ст. 205-1","205-1",262,0,0,0,257,2,0,0,0,84,92,72,6,3,84,62,33,160,1,1,256,1,0,0,0
2021,"VII",FALSE,"Протиправне заволодіння майном підприємства, установи, організації, ст. 206-2","206-2",16,0,0,0,5,2,0,0,0,0,1,2,2,0,1,4,1,0,0,0,5,0,0,0,0
2021,"VII",FALSE,"Легалізація (відмивання) майна, одержаного злочинним шляхом, ст. 209","209",77,1,0,0,54,4,0,0,0,7,22,17,1,7,19,33,7,14,0,0,53,1,0,0,0
2021,"VII",FALSE,"Нецільове використання бюджетних коштів, здійснення видатків бюджету чи надання кредитів з бюджету без встановлених бюджетних призначень або з їх перевищенням, ст. 210","210",1,0,0,0,1,0,0,0,0,0,0,0,0,1,0,1,0,0,0,0,1,0,0,0,0
2021,"VII",FALSE,"Видання нормативно-правових актів, що зменшують надходження бюджету або збільшують витрати бюджету всупереч закону, ст. 211","211",0,0,0,0,0,0,0,0,0,0,0,0,0,0,0,0,0,0,0,0,0,0,0,0,0
2021,"VII",FALSE,"Ухилення від сплати податків, зборів (обов'язкових платежів), ст. 212","212",63,0,0,0,55,0,0,0,0,1,17,26,7,4,10,33,4,18,0,0,55,0,0,0,0
2021,"VII",FALSE,"Порушення порядку здійснення заготівлі металобрухту та операцій з металобрухтом, ст. 213","213",55,0,0,0,54,0,0,0,0,9,9,23,7,6,11,1,8,43,1,1,53,1,0,0,0
2021,"VII",FALSE,"Доведення банку до неплатоспроможності, ст. 218-1","218-1",0,0,0,0,0,0,0,0,0,0,0,0,0,0,0,0,0,0,0,0,0,0,0,0,0
2021,"VII",FALSE,"Порушення порядку ведення бази даних про вкладників або порядку формування звітності, ст. 220-1","220-1",0,0,0,0,0,0,0,0,0,0,0,0,0,0,0,0,0,0,0,0,0,0,0,0,0
2021,"VII",FALSE,"Фальсифікація фінансових документів та звітності фінансової організації, приховування неплатоспроможності фінансової установи або підстав для відкликання (анулювання) ліцензії фінансової установи, ст. 220-2","220-2",12,0,0,0,0,0,0,0,0,0,0,0,0,0,0,0,0,0,0,0,0,0,0,0,0
2021,"VII",FALSE,"Шахрайство з фінансовими ресурсами, ст. 222","222",93,0,0,0,72,3,0,0,0,13,30,18,3,8,32,14,20,38,0,0,71,1,0,0,0
2021,"VII",FALSE,"Підроблення документів, які подаються для реєстрації випуску цінних паперів, ст. 223-1","223-1",0,0,0,0,0,0,0,0,0,0,0,0,0,0,0,0,0,0,0,0,0,0,0,0,0
2021,"VII",FALSE,"Незаконна приватизація державного, комунального майна, ст. 233","233",4,0,0,0,0,0,0,0,0,0,0,0,0,0,0,0,0,0,0,0,0,0,0,0,0
2021,"VIII",TRUE,"Кримінальні правопорушення проти довкілля (р. VІІІ Кримінального кодексу  України )",NA,1442,0,2,0,1272,5,0,0,7,215,428,431,81,110,28,123,254,882,9,4,1269,3,0,0,0
2021,"VIII",FALSE,"Порушення правил охорони або використання надр, ст. 240","240",104,0,1,0,90,0,0,0,1,11,27,35,4,12,3,13,23,53,1,0,90,0,0,0,0
2021,"VIII",FALSE,"Незаконна порубка або незаконне перевезення, зберігання, збут лісу, ст. 246","246",725,0,1,0,595,3,0,0,5,123,190,198,41,38,6,51,111,425,4,4,594,1,0,0,0
2021,"IX",TRUE,"Кримінальні правопорушення проти громадської безпеки (р. IX Кримінального кодексу України )",NA,3896,29,0,0,3416,284,0,5,22,603,1121,1213,213,239,103,398,742,2245,26,5,3370,43,3,0,0
2021,"IX",FALSE,"Створення злочинної організації, ст. 255","255",205,14,0,0,54,6,0,0,0,12,28,11,2,1,8,21,19,14,0,0,54,0,0,0,0
2021,"IX",FALSE,"Сприяння учасникам злочинних організацій та укриття їх злочинної  діяльності, ст. 256","256",0,0,0,0,0,0,0,0,0,0,0,0,0,0,0,0,0,0,0,0,0,0,0,0,0
2021,"IX",FALSE,"Бандитизм, ст. 257","257",19,0,0,0,13,8,0,0,0,5,7,1,0,0,1,2,3,8,0,0,13,0,0,0,0
2021,"IX",FALSE,"Терористичний акт, ст. 258","258",2,0,0,0,1,1,0,0,0,0,0,1,0,0,0,1,0,0,0,0,1,0,0,0,0
2021,"IX",FALSE,"Втягнення у вчинення терористичного акту, ст. 258-1","258-1",0,0,0,0,0,0,0,0,0,0,0,0,0,0,0,0,0,0,0,0,0,0,0,0,0
2021,"IX",FALSE,"Публічні заклики до вчинення терористичного акту, ст. 258-2","258-2",1,0,0,0,0,0,0,0,0,0,0,0,0,0,0,0,0,0,0,0,0,0,0,0,0
2021,"IX",FALSE,"Створення терористичної групи чи терористичної організації, ст. 258-3","258-3",58,9,0,0,38,12,0,0,1,10,18,8,0,1,5,15,5,17,1,0,37,1,0,0,0
2021,"IX",FALSE,"Сприяння вчиненню терористичного акту , ст. 258-4","258-4",0,0,0,0,0,0,0,0,0,0,0,0,0,0,0,0,0,0,0,0,0,0,0,0,0
2021,"IX",FALSE,"Фінансування тероризму, ст. 258-5","258-5",4,0,0,0,2,0,0,0,0,0,2,0,0,0,0,1,1,0,0,0,2,0,0,0,0
2021,"IX",FALSE,"Завідомо неправдиве повідомлення про загрозу безпеці громадян, знищення чи пошкодження об’єктів  власності, ст. 259","259",171,0,0,0,148,24,0,4,1,28,54,39,11,11,8,20,27,95,5,1,148,0,0,0,0
2021,"IX",FALSE,"Створення не передбачених законом воєнізованих або збройних формувань, ст. 260","260",140,22,0,0,112,2,0,0,0,26,47,32,5,2,4,18,34,58,2,0,110,2,0,0,0
2021,"IX",FALSE,"Викрадення, привласнення, вимагання вогнепальної зброї, бойових припасів, вибухових речовин чи радіоактивних матеріалів або заволодіння ними шляхом шахрайства або зловживанням службовим становищем, ст. 262","262",12,0,0,0,12,0,0,0,1,6,4,1,0,0,0,2,0,10,0,0,12,0,0,0,0
2021,"IX",FALSE,"Незаконне поводження зі зброєю, бойовими припасами або вибуховими  речовинами, ст. 263","263",3198,16,0,0,3012,219,0,1,20,518,966,1091,192,224,75,318,671,2001,18,4,2972,37,3,0,0
2021,"IX",FALSE,"Незаконне виготовлення, переробка чи ремонт вогнепальної зброї або фальсифікація, незаконне видалення чи зміна її маркування, або незаконне виготовлення бойових припасів, вибухових речовин чи вибухових  пристроїв, ст. 263-1","263-1",74,0,0,0,73,5,0,0,1,6,14,33,2,17,0,11,21,39,2,0,72,1,0,0,0
2021,"IX",FALSE,"Недбале зберігання вогнепальної зброї або бойових припасів, ст. 264","264",4,0,0,0,4,0,0,0,0,0,1,1,0,2,0,2,1,1,0,0,4,0,0,0,0
2021,"IX",FALSE,"Незаконне поводження з радіоактивними матеріалами, ст. 265","265",1,0,0,0,1,0,0,0,0,0,0,0,1,0,0,1,0,0,0,0,1,0,0,0,0
2021,"IX",FALSE,"Порушення правил поводження з вибуховими, легкозаймистими та їдкими речовинами або радіоактивними матеріалами, ст. 267","267",1,0,0,0,1,0,0,0,0,0,0,1,0,0,0,1,0,0,0,0,1,0,0,0,0
2021,"X",TRUE,"Кримінальні правопорушення проти безпеки виробництва (р. X Кримінального кодексу України )",NA,39,0,0,0,36,1,0,0,0,2,12,15,4,3,7,16,13,7,0,0,36,0,0,0,0
2021,"XI",TRUE,"Кримінальні правопорушення проти безпеки руху та експлуатації транспорту  (р. XІ Кримінального кодексу України )",NA,6064,5,4,0,5540,413,17,64,157,1620,1710,1239,274,459,350,1377,1192,2889,69,13,5457,77,6,0,1
2021,"XI",FALSE,"Порушення правил безпеки руху або експлуатації залізничного, водного чи повітряного транспорту, ст. 276","276",0,0,0,0,0,0,0,0,0,0,0,0,0,0,0,0,0,0,0,0,0,0,0,0,0
2021,"XI",FALSE,"Порушення правил безпеки дорожнього  руху або експлуатації транспорту особами,  які керують транспортними засобами, ст. 286","286",3759,0,3,0,3537,67,1,8,39,828,1053,927,250,431,316,1200,807,1515,12,3,3487,48,2,0,1
2021,"XI",FALSE,"Незаконне заволодіння транспортним засобом, ст. 289","289",1765,5,0,0,1562,251,16,56,119,656,486,200,15,14,20,93,266,1136,58,9,1536,22,4,0,0
2021,"XI",FALSE,"Знищення, підробка або заміна номерів вузлів та агрегатів транспортного  засобу, ст. 290*","290",9,0,0,0,8,0,0,0,0,3,2,2,1,0,1,3,4,1,0,0,8,0,0,0,0
2021,"XII",TRUE,"Кримінальні правопорушення проти громадського порядку та моральності  (р. XІІ Кримінального кодексу України )",NA,2178,0,2,0,1843,142,7,29,56,690,596,374,46,45,161,299,296,1206,35,7,1814,26,3,0,0
2021,"XII",FALSE,"Хуліганство, ст. 296","296",1470,0,2,0,1264,105,3,21,52,505,422,223,19,19,40,224,193,824,22,1,1239,24,1,0,0
2021,"XII",FALSE,"Наруга над могилою, іншим місцем поховання або над тілом померлого,  ст. 297","297",228,0,0,0,215,14,4,6,2,41,69,76,11,6,17,7,28,168,10,2,214,0,1,0,0
2021,"XII",FALSE,"Жорстоке поводження з тваринами, ст. 299","299",65,0,0,0,63,0,0,0,0,4,22,20,5,12,7,4,13,44,2,0,63,0,0,0,0
2021,"XII",FALSE,"Ввезення, виготовлення, збут і розповсюдження порнографічних предметів,  ст. 301","301",194,0,0,0,117,3,0,1,2,61,30,17,3,3,49,28,24,65,0,0,116,1,0,0,0
2021,"XII",FALSE,"Створення або утримання місць розпусти і звідництво, ст. 302","302",50,0,0,0,40,1,0,0,0,13,9,14,3,1,24,9,7,24,0,0,38,1,1,0,0
2021,"XII",FALSE,"Сутенерство або втягнення особи в заняття проституцією, ст. 303","303",62,0,0,0,42,2,0,0,0,19,12,8,1,2,23,12,7,23,0,0,41,1,0,0,0
2021,"XII",FALSE,"Втягнення неповнолітніх у протиправну діяльність, ст. 304","304",79,0,0,0,77,9,0,0,0,44,25,6,1,1,13,3,10,58,2,4,77,0,0,0,0
2021,"XIII",TRUE,"Кримінальні правопорушення у сфері обігу наркотичних засобів, психотропних речовин, їх аналогів або прекурсорів та інші кримінальні правопорушення проти здоров'я населення (р. XІІІ Кримінального кодексу України )",NA,12649,0,2,0,11579,625,0,14,93,2993,4935,2886,270,388,1206,1236,2149,8086,80,28,11454,111,14,5,1
2021,"XIII",FALSE,"Контрабанда наркотичних засобів, психотропних речовин, їх аналогів чи прекурсорів або фальсифікованих лікарських засобів, ст. 305","305",113,0,0,0,99,17,0,0,0,28,41,25,3,2,10,20,21,53,2,3,79,20,0,0,0
2021,"XIII",FALSE,"Використання коштів, здобутих від незаконного обігу наркотичних засобів, психотропних речовин, їх аналогів, прекурсорів, отруйних чи сильнодіючих речовин або отруйних чи сильнодіючих лікарських засобів, ст. 306","306",29,0,0,0,8,4,0,0,0,3,3,2,0,0,1,4,1,3,0,0,8,0,0,0,0
2021,"XIII",FALSE,"Незаконне виробництво, виготовлення, придбання, зберігання, перевезення, пересилання чи збут наркотичних засобів, психотропних речовин або  їх аналогів, ст. 307","307",2228,0,1,0,1462,525,0,3,36,581,563,252,18,9,223,177,279,976,12,18,1445,15,2,0,0
2021,"XIII",FALSE,"Викрадення, привласнення, вимагання наркотичних засобів, психотропних речовин або їх аналогів чи заволодіння ними шляхом шахрайства або зловживання службовим становищем, ст. 308","308",56,0,0,0,21,8,0,0,0,3,12,4,0,2,4,3,4,14,0,0,21,0,0,0,0
2021,"XIII",FALSE,"Незаконне виробництво, виготовлення, придбання, зберігання, перевезення чи пересилання наркотичних засобів, психотропних речовин або їх аналогів  без мети збуту, ст. 309","309",9406,0,1,0,9287,140,0,11,57,2358,4204,2329,173,155,658,972,1689,6550,65,11,9197,77,13,5,1
2021,"XIII",FALSE,"Посів або вирощування снотворного маку чи конопель ст. 310","310",1225,0,0,0,1199,27,0,0,1,87,304,478,96,233,315,91,251,852,5,0,1191,7,1,0,0
2021,"XIII",FALSE,"Незаконне виробництво, виготовлення, придбання, зберігання, перевезення чи пересилання прекурсорів, ст. 311","311",169,0,0,0,141,21,0,0,0,28,77,30,5,1,10,12,32,97,0,0,138,3,0,0,0
2021,"XIII",FALSE,"Викрадення, привласнення, вимагання прекурсорів або заволодіння ними шляхом шахрайства або зловживання службовим становищем, ст. 312","312",0,0,0,0,0,0,0,0,0,0,0,0,0,0,0,0,0,0,0,0,0,0,0,0,0
2021,"XIII",FALSE,"Викрадення, привласнення, вимагання обладнання, призначеного для  виготовлення наркотичних засобів, психотропних речовин, або їх аналогів чи заволодіння ним шляхом шахрайства або зловживання службовим становищем та інші незаконні дії з таким обладнанням, ст. 313","313",65,0,0,0,56,9,0,0,0,16,29,10,1,0,2,7,16,33,0,0,56,0,0,0,0
2021,"XIII",FALSE,"Незаконне введення в організм наркотичних засобів,  психотропних речовин або їх аналогів, ст. 314","314",0,0,0,0,0,0,0,0,0,0,0,0,0,0,0,0,0,0,0,0,0,0,0,0,0
